{
  "schema_version": 1,
  "stage": "flux",
  "run_id": "11111111-1111-4111-8111-111111111111",
  "invocation_id": "22222222-2222-4222-8222-222222222222",
  "ok": true,
  "model": {
    "id": "black-forest-labs/FLUX.2-klein-4B",
    "revision": "synthetic-fixture-revision",
    "precision": "synthetic",
    "runtime": "synthetic-fixture"
  },
  "data": {
    "image_base64": "UklGRooHAABXRUJQVlA4IH4HAACQ3wCdASoABAAEPm02mUmkIyKhIAgAgA2JaW7hd2EbQAnsA99snIe+2TkPfbJyHvtk5D32ych77ZOQ99snIe+2TkPfbJyHvtk5D32ych77ZOQ99snIe+2TkPfbJyHvtk5D32ych77ZOQ99snIe+2TkPfbJyHvtk5D32ych77ZOQ99snIe+2TkPfbJyHvtk5D32ych77ZOQ99snIe+2TkPfbJyHvtk5D32ych77ZOQ99snIe+2TkPfbJyHvtk5D32ych77ZOQ99snIe+2TkPfbJyHvtk5D32ych77ZOQ99snIe+2TkPfbJyHvtk5D32ych77ZOQ99snIe+2TkPfbJyHvtk5D32ych77ZOQ99snIe+2TkPfbJyHvtk5D32ych77ZOQ99snIe+2TkPfbJyHvtk5D32ych77ZOQ99snIe+2TkPfbJyHvtk5D32ych77ZOQ99snIe+2TkPfbJyHvtk5D32ych77ZOQ99snIe+2TkPfbJyHvtk5D32ych77ZOQ99snIe+2TkPfbJyHvtk5D32ych77ZOQ99snIe+2TkPfbJyHvtk5D32ych77ZOQ99snIe+2TkPfbJyHvtk5D32ych77ZOQ99snIe+2TkPfbJyHvtk5D32ych77ZOQ99snIe+2TkPfbJyHvtk5D32ych77ZOQ99snIe+2TkPfbJyHvtk5D32ych77ZOQ99snIe+2TkPfbJyHvtk5D32ych77ZOQ99snIe+2TkPfbJyHvtk5D32ych77ZOQ99snIe+2TkPfbJyHvtk5D32ych77ZOQ99snIe+2TkPfbJyHvtk5D32ych77ZOQ99snIe+2TkPfbJyHvtk5D32ych77ZOQ99snIe+2TkPfbJyHvtk5D32ych77ZOQ99snIe+2TkPfbJyHvtk5D32ych77ZOQ99snIe+2TkPfbJyHvtk5D32ych77ZOQ99snIe+2TkPfbJyHvtk5D32ych77ZOQ99snIe+2TkPfbJyHvtk5D32ych77ZOQ99snIe+2TkPfbJyHvtk5D32ych77ZOQ99snIe+2TkPfbJyHvtk5D32ych77ZOQ99snIe+2TkPfbJyHvtk5D32ych77ZOQ99snIe+2TkPfbJyHvtk5D32ych77ZOQ99snIe+2TkPfbJyHvtk5D32ych77ZOQ99snIe+2TkPfbJyHvtk5D32ych77ZOQ99snIe+2TkPfbJyHvtk5D32ych77ZOQ99snIe+2TkPfbJyHvtk5D32ych77ZOQ99snIe+2TkPfbJyHvtk5D32ych77ZOQ99snIe+2TkPfbJyHvtk5D32ych77ZOQ99snIe+2TkPfbJyHvtk5D32ych77ZOQ99snIe+2TkPfbJyHvtk5D32ych77ZOQ99snIe+2TkPfbJyHvtk5D32ych77ZOQ99snIe+2TkPfbJyHvtk5D32ych77ZOQ99snIe+2TkPfbJyHvtk5D32ych77ZOQ99snIe+2TkPfbJyHvtk5D32ych77ZOQ99snIe+2TkPfbJyHvtk5D32ych77ZOQ99snIe+2TkPfbJyHvtk5D32ych77ZOQ99snIe+2TkPfbJyHvtk5D32ych77ZOQ99snIe+2TkPfbJyHvtk5D32ych77ZOQ99snIe+2TkPfbJyHvtk5D32ych77ZOQ99snIe+2TkPfbJyHvtk5D32ych77ZOQ99snIe+2TkPfbJyHvtk5D32ych77ZOQ99snIe+2TkPfbJyHvtk5D32ych77ZOQ99snIe+2TkPfbJyHvtk5D32ych77ZOQ99snIe+2TkPfbJyHvtk5D32ych77ZOQ99snIe+2TkPfbJyHvtk5D32ych77ZOQ99snIe+2TkPfbJyHvtk5D32ych77ZOQ99snIe+2TkPfbJyHvtk5D32ych77ZOQ99snIe+2TkPfbJyHvtk5D32ych77ZOQ99snIe+2TkPfbJyHvtk5D32ych77ZOQ99snIe+2TkPfbJyHvtk5D32ych77ZOQ99snIe+2TkPfbJyHvtk5D32ych77ZOQ99snIe+2TkPfbJyHvtk5D32ych77ZOQ99snIe+2TkPfbJyHvtk5D32ych77ZOQ99snIe+2TkPfbJyHvtk5D32ych77ZOQ99snIe+2TkPfbJyHvtk5D32ych77ZOQ99snIe+2TkPfbJyHvtk5D32ych77ZOQ99snIe+2TkPfbJyHvtk5D32ych77ZOQ99snIe+2TkPfbJyHvtk5D32ych77ZOQ99snIe+2TkPfbJyHvtk5D32ych77ZOQ99snIe+2TkPfbJyHvtk5D32ych77ZOQ99snIe+2TkPfbJyHvtk5D32ych77ZOQ99snIe+2TkPfbJyHvtk5D32ych77ZOQ99snIe+2TkPfbJyHvtk5D32rAA/v/MR/+rSaRef/4i6e8AwQAAAAAAAAAAAAAAAAAAAAAAAAAAAAAAAAAAAAAAAAAAAAAAAAAAAAAAAAAAAAAAAAAAAAAAAAAAAAAAAAAAAAAAAAAAAAAAAAAAAAAAAAAAAAAAAAAAAAAAAAAAAAAAAAAAAAAAAAAA",
    "mime_type": "image/webp",
    "width": 1024,
    "height": 1024,
    "seed": 42,
    "image_bytes": 1938
  },
  "usage": {
    "image_count": 1
  },
  "timings": {
    "inference_ms": 125.0
  },
  "counters": {
    "inference_attempts": 1,
    "inference_retries": 0,
    "dependency_retries": 0
  },
  "error": null
}
